bib_key	entry_type	used_in_tex	authors	year	title	container	publisher_or_institution	volume	number	pages	doi	url	isbn	eprint	bib_note	source_link	download_status	downloaded_file_path	manual_reason	english_tex_locations	chinese_tex_locations	english_citation_sentences	chinese_citation_sentences	english_reference_meaning	chinese_reference_meaning	verification_notes
MopuriGrahnSedarskyHyvonen2024	Article	true	Mopuri, Lokesh and Grahn, Viljam and Sedarsky, David and Hyvonen, Jari	2024	Shape/Penetration Analysis and Comparisons of Isolated Spray Plumes in a Multi-Hole Diesel Spray	Experiments in Fluids		65		92	10.1007/s00348-024-03829-6					https://doi.org/10.1007/s00348-024-03829-6	downloaded	reference_sources/MopuriGrahnSedarskyHyvonen2024.pdf		sections_en/02_literature_review.tex:197	sections_zh/02_literature_review.tex:203	More importantly, a multi-hole spray is not a mechanical replication of a single-hole spray \(N\) times: internal sac flows, inter-hole interactions, and plume-to-plume disturbances alter the final morphology, differences which single-hole models struggle to encompass a priori \cite{JinKimKakamiNishidaOgataLuo2020,MopuriGrahnSedarskyHyvonen2024}.	更重要的是，多孔喷雾并不是将单孔喷雾机械复制 \(N\) 次： 内部 sac 流动、孔间相互作用和喷油束间扰动都会改变最终形态，单孔模型难以预先包含这些差异 \cite{JinKimKakamiNishidaOgataLuo2020,MopuriGrahnSedarskyHyvonen2024}。	Supports the multi-hole spray context and the need to analyze isolated plume shape and penetration consistently.	用于支撑多孔喷雾背景，以及对独立 plume 形状和穿深进行一致分析的必要性。	Downloaded legal open PDF from https://link.springer.com/content/pdf/10.1007/s00348-024-03829-6.pdf
JinKimKakamiNishidaOgataLuo2020	Article	true	Jin, Yu and Kim, Jaeheun and Kakami, Shinichi and Nishida, Keiya and Ogata, Yoichi and Luo, Hongliang	2020	Comparison of Diesel Spray with Small Injection Amount Between Single-Hole and Multi-Hole Injectors: Results Under Same Rail Pressure and Similar Injection Rate	International Communications in Heat and Mass Transfer		118		104862	10.1016/j.icheatmasstransfer.2020.104862					https://doi.org/10.1016/j.icheatmasstransfer.2020.104862	manual_required		No clearly legal open PDF/HTML download was found automatically; use the DOI/URL manually or through institutional access if needed.	sections_en/02_literature_review.tex:197	sections_zh/02_literature_review.tex:203	More importantly, a multi-hole spray is not a mechanical replication of a single-hole spray \(N\) times: internal sac flows, inter-hole interactions, and plume-to-plume disturbances alter the final morphology, differences which single-hole models struggle to encompass a priori \cite{JinKimKakamiNishidaOgataLuo2020,MopuriGrahnSedarskyHyvonen2024}.	更重要的是，多孔喷雾并不是将单孔喷雾机械复制 \(N\) 次： 内部 sac 流动、孔间相互作用和喷油束间扰动都会改变最终形态，单孔模型难以预先包含这些差异 \cite{JinKimKakamiNishidaOgataLuo2020,MopuriGrahnSedarskyHyvonen2024}。	Supports the point that multi-hole injector behavior is not a trivial repetition of single-hole spray behavior.	用于支撑多孔喷嘴行为不能简单视为单孔喷雾重复叠加的论点。	Checked direct URL, arXiv when applicable, and OpenAlex OA metadata.
imo2023ghgstrategy	Misc	true	International Maritime Organization	2023	2023 IMO Strategy on Reduction of GHG Emissions from Ships							https://www.imo.org/en/ourwork/environment/pages/2023-imo-strategy-on-reduction-of-ghg-emissions-from-ships.aspx			Accessed 30 March 2026	https://www.imo.org/en/ourwork/environment/pages/2023-imo-strategy-on-reduction-of-ghg-emissions-from-ships.aspx	downloaded	reference_sources/imo2023ghgstrategy.pdf		sections_en/01_introduction.tex:5 || sections_en/01_introduction_technical_backup.tex:5	sections_zh/01_introduction.tex:5 || sections_zh/01_introduction_technical_backup.tex:5	The International Maritime Organization (IMO) 2023 strategy and industry order trends indicate that alternative fuel propulsion systems have gradually transitioned from long-term concepts to engineering realities \cite{imo2023ghgstrategy,classnk2025alternativefuels}. || The IMO 2023 strategy and industry orderbook trends have turned alternative-fuel propulsion from a distant vision into a practical engineering reality \cite{imo2023ghgstrategy,classnk2025alternativefuels}.	国际海事组织（IMO）2023 战略及行业订单趋势表明，替代燃料推进系统已由远期概念逐步转化为工程现实 \cite{imo2023ghgstrategy,classnk2025alternativefuels}。 || IMO 2023 战略及行业订单趋势表明，替代燃料推进系统已由远期概念逐步转化为工程现实 \cite{imo2023ghgstrategy,classnk2025alternativefuels}。	Supports the maritime decarbonization context and 2030 targets motivating alternative-fuel marine engines.	用于支撑海运减排背景和 2030 目标，从而引出替代燃料船用发动机需求。	Downloaded legal open PDF from https://wwwcdn.imo.org/localresources/en/OurWork/Environment/Documents/annex/MEPC%2080/Annex%2015.pdf
classnk2025alternativefuels	Misc	true	ClassNK	2025	Alternative Fuels Insight							https://futurefuels.imo.org/wp-content/uploads/2025/02/ClassNKAlternativeFuelsInsight_e.pdf			Accessed 30 March 2026	https://futurefuels.imo.org/wp-content/uploads/2025/02/ClassNKAlternativeFuelsInsight_e.pdf	downloaded	reference_sources/classnk2025alternativefuels.pdf		sections_en/01_introduction.tex:5 || sections_en/01_introduction_technical_backup.tex:5	sections_zh/01_introduction.tex:5 || sections_zh/01_introduction_technical_backup.tex:5	The International Maritime Organization (IMO) 2023 strategy and industry order trends indicate that alternative fuel propulsion systems have gradually transitioned from long-term concepts to engineering realities \cite{imo2023ghgstrategy,classnk2025alternativefuels}. || The IMO 2023 strategy and industry orderbook trends have turned alternative-fuel propulsion from a distant vision into a practical engineering reality \cite{imo2023ghgstrategy,classnk2025alternativefuels}.	国际海事组织（IMO）2023 战略及行业订单趋势表明，替代燃料推进系统已由远期概念逐步转化为工程现实 \cite{imo2023ghgstrategy,classnk2025alternativefuels}。 || IMO 2023 战略及行业订单趋势表明，替代燃料推进系统已由远期概念逐步转化为工程现实 \cite{imo2023ghgstrategy,classnk2025alternativefuels}。	Supports the claim that alternative fuels have moved into concrete vessel and orderbook decisions.	用于支撑替代燃料已经进入实际船舶和订单决策阶段的行业背景。	Downloaded legal open PDF from https://futurefuels.imo.org/wp-content/uploads/2025/02/ClassNKAlternativeFuelsInsight_e.pdf
wartsila_decarbonisation_2026	Misc	false	Wärtsilä	2026	Shaping the Decarbonisation of Marine and Energy							https://www.wartsila.com/about/decarbonisation			Accessed 16 April 2026	https://www.wartsila.com/about/decarbonisation	manual_required		No clearly legal open PDF/HTML download was found automatically; use the DOI/URL manually or through institutional access if needed.					Industry decarbonization context for marine dual-fuel and alternative-fuel engines that motivates the pilot-injection screening problem.	船用双燃料与替代燃料发动机减排的行业背景，引出引燃喷射筛查问题。	Checked direct URL, arXiv when applicable, and OpenAlex OA metadata.
wingd_xdf_manual_2021	Manual	true	WinGD	2021	Marine Installation Manual: WinGD X52DF							https://wingd.com/media/3vpbi3s2/mim_wingd_x52df_20210709.pdf			Accessed 30 March 2026	https://wingd.com/media/3vpbi3s2/mim_wingd_x52df_20210709.pdf	downloaded	reference_sources/wingd_xdf_manual_2021.pdf		sections_en/01_introduction.tex:12 || sections_en/01_introduction_technical_backup.tex:20	sections_zh/01_introduction.tex:12 || sections_zh/01_introduction_technical_backup.tex:19	While the fuel system becomes more low-carbon and adaptable due to alternative fuels, the combustion process still hinges on one small but critical local event: the diesel pilot injection \cite{wingd_xdf_manual_2021,classnk_methanol_2024}. || Pilot diesel injection therefore remains a critical enabling mechanism in multi-fuel marine engines: it initiates combustion in a low-reactivity alternative-fuel main charge that does not auto-ignite under practical compression-ignition conditions \cite{wingd_xdf_manual_2021,classnk_methanol_2024}.	燃料系统因替代燃料而更低碳、更灵活，但燃烧过程仍依赖一个尺度较小却十分关键的局部事件：柴油预喷 \cite{wingd_xdf_manual_2021,classnk_methanol_2024}。 || 因此，柴油预喷仍是多燃料船用发动机中的关键使能机制， 其作用是在主燃料难以自行压燃的条件下提供稳定点火源 \cite{wingd_xdf_manual_2021,classnk_methanol_2024}。	Supports the description of WinGD X-DF operation and pilot-fuel ignition in low-pressure gas mode.	用于支撑 WinGD X-DF 低压燃气运行和 pilot fuel 点火机制的描述。	Downloaded legal open PDF from https://wingd.com/media/3vpbi3s2/mim_wingd_x52df_20210709.pdf
wingd_lng_faq_2025	Misc	true	WinGD	2025	LNG Dual-Fuel Engines FAQ Booklet							https://wingd.com/media/txynsqmf/wingd-lng-faq-booklet.pdf			Accessed 30 March 2026	https://wingd.com/media/txynsqmf/wingd-lng-faq-booklet.pdf	downloaded	reference_sources/wingd_lng_faq_2025.pdf		sections_en/01_introduction.tex:7 || sections_en/01_introduction_technical_backup.tex:9	sections_zh/01_introduction.tex:7 || sections_zh/01_introduction_technical_backup.tex:8	As fuels such as liquefied natural gas (LNG), methanol, and ammonia are adopted to mitigate carbon emission intensity, marine dual-fuel and multi-fuel engines have emerged as a vital trajectory in the research and development of large-scale power systems \cite{wingd_lng_faq_2025,wingd_ammonia_faq_2025,classnk_methanol_2024}. || Consequently, marine dual-fuel and multi-fuel engines have become an important development direction for large propulsion systems \cite{wingd_lng_faq_2025,wingd_ammonia_faq_2025,classnk_methanol_2024}.	随着液化天然气（LNG）、甲醇和氨等燃料被用于降低碳排放强度，船用双燃料和多燃料发动机已成为大型动力系统研发中的重要方向 \cite{wingd_lng_faq_2025,wingd_ammonia_faq_2025,classnk_methanol_2024}。 || 因此，船用双燃料和多燃料发动机已成为大型动力系统研发中的重要方向 \cite{wingd_lng_faq_2025,wingd_ammonia_faq_2025,classnk_methanol_2024}。	Supports the practical LNG dual-fuel engine context and fallback/pilot-fuel operation.	用于支撑 LNG 双燃料发动机的实际运行背景、pilot fuel 和模式切换说明。	Downloaded legal open PDF from https://wingd.com/media/txynsqmf/wingd-lng-faq-booklet.pdf
classnk_methanol_2024	TechReport	true	ClassNK	2024	Studies on In-Engine Combustion of Low and Zero-Carbon Fuels							https://www.classnk.or.jp/hp/pdf/research/rd/2023/07_e09.pdf			Accessed 30 March 2026	https://www.classnk.or.jp/hp/pdf/research/rd/2023/07_e09.pdf	downloaded	reference_sources/classnk_methanol_2024.pdf		sections_en/01_introduction.tex:7 || sections_en/01_introduction.tex:12 || sections_en/01_introduction_technical_backup.tex:9 || sections_en/01_introduction_technical_backup.tex:20	sections_zh/01_introduction.tex:7 || sections_zh/01_introduction.tex:12 || sections_zh/01_introduction_technical_backup.tex:8 || sections_zh/01_introduction_technical_backup.tex:19	As fuels such as liquefied natural gas (LNG), methanol, and ammonia are adopted to mitigate carbon emission intensity, marine dual-fuel and multi-fuel engines have emerged as a vital trajectory in the research and development of large-scale power systems \cite{wingd_lng_faq_2025,wingd_ammonia_faq_2025,classnk_methanol_2024}. || While the fuel system becomes more low-carbon and adaptable due to alternative fuels, the combustion process still hinges on one small but critical local event: the diesel pilot injection \cite{wingd_xdf_manual_2021,classnk_methanol_2024}. || Consequently, marine dual-fuel and multi-fuel engines have become an important development direction for large propulsion systems \cite{wingd_lng_faq_2025,wingd_ammonia_faq_2025,classnk_methanol_2024}. || Pilot diesel injection therefore remains a critical enabling mechanism in multi-fuel marine engines: it initiates combustion in a low-reactivity alternative-fuel main charge that does not auto-ignite under practical compression-ignition conditions \cite{wingd_xdf_manual_2021,classnk_methanol_2024}.	随着液化天然气（LNG）、甲醇和氨等燃料被用于降低碳排放强度，船用双燃料和多燃料发动机已成为大型动力系统研发中的重要方向 \cite{wingd_lng_faq_2025,wingd_ammonia_faq_2025,classnk_methanol_2024}。 || 燃料系统因替代燃料而更低碳、更灵活，但燃烧过程仍依赖一个尺度较小却十分关键的局部事件：柴油预喷 \cite{wingd_xdf_manual_2021,classnk_methanol_2024}。 || 因此，船用双燃料和多燃料发动机已成为大型动力系统研发中的重要方向 \cite{wingd_lng_faq_2025,wingd_ammonia_faq_2025,classnk_methanol_2024}。 || 因此，柴油预喷仍是多燃料船用发动机中的关键使能机制， 其作用是在主燃料难以自行压燃的条件下提供稳定点火源 \cite{wingd_xdf_manual_2021,classnk_methanol_2024}。	Supports the discussion that methanol concepts still require ignition support or combustion-system adaptation.	用于支撑甲醇燃料方案仍需要点火支持或燃烧系统适配的论述。	Downloaded legal open PDF from https://www.classnk.or.jp/hp/pdf/research/rd/2023/07_e09.pdf
wingd_ammonia_faq_2025	Misc	true	WinGD	2025	Ammonia Dual-Fuel Engines FAQ Booklet							https://wingd.com/media/2gyl3j0v/wingd-ammonia-faq-booklet.pdf			Accessed 30 March 2026	https://wingd.com/media/2gyl3j0v/wingd-ammonia-faq-booklet.pdf	manual_required		No clearly legal open PDF/HTML download was found automatically; use the DOI/URL manually or through institutional access if needed.	sections_en/01_introduction.tex:7 || sections_en/01_introduction_technical_backup.tex:9	sections_zh/01_introduction.tex:7 || sections_zh/01_introduction_technical_backup.tex:8	As fuels such as liquefied natural gas (LNG), methanol, and ammonia are adopted to mitigate carbon emission intensity, marine dual-fuel and multi-fuel engines have emerged as a vital trajectory in the research and development of large-scale power systems \cite{wingd_lng_faq_2025,wingd_ammonia_faq_2025,classnk_methanol_2024}. || Consequently, marine dual-fuel and multi-fuel engines have become an important development direction for large propulsion systems \cite{wingd_lng_faq_2025,wingd_ammonia_faq_2025,classnk_methanol_2024}.	随着液化天然气（LNG）、甲醇和氨等燃料被用于降低碳排放强度，船用双燃料和多燃料发动机已成为大型动力系统研发中的重要方向 \cite{wingd_lng_faq_2025,wingd_ammonia_faq_2025,classnk_methanol_2024}。 || 因此，船用双燃料和多燃料发动机已成为大型动力系统研发中的重要方向 \cite{wingd_lng_faq_2025,wingd_ammonia_faq_2025,classnk_methanol_2024}。	Supports the discussion that ammonia dual-fuel concepts require pilot fuel because ammonia is difficult to auto-ignite.	用于支撑氨双燃料概念因自燃困难而仍需 pilot fuel 的论述。	Checked direct URL, arXiv when applicable, and OpenAlex OA metadata.
ecn_liquid_penetration	Misc	true	Engine Combustion Network		Liquid Penetration Length							https://ecn.sandia.gov/diesel-spray-combustion/experimental-diagnostics/liquid-penetration-length/			Accessed 30 March 2026	https://ecn.sandia.gov/diesel-spray-combustion/experimental-diagnostics/liquid-penetration-length/	downloaded	reference_sources/ecn_liquid_penetration.html		sections_en/01_introduction_technical_backup.tex:78 || sections_en/02_literature_review.tex:63 || sections_en/06_discussion.tex:34 || sections_en/06_discussion.tex:45	sections_zh/01_introduction_technical_backup.tex:63 || sections_zh/02_literature_review.tex:65 || sections_zh/06_discussion.tex:33 || sections_zh/06_discussion.tex:43	\cite{MagnottiGenzale2013,JohnsonNaberLee2012,ecn_liquid_penetration,ecn_liquid_penetration_accessory}. || The Engine Combustion Network (ECN) benchmark studies provided systematic evidence for this methodological dependency: inter-facility comparisons of nominally identical injectors (Spray~A and Spray~D) revealed scatter in liquid-phase penetration arising from a combination of genuine ambient-condition differences, distinct optical setups (DBI versus Mie), and post-processing threshold definitions \cite{ecn_liquid_penetration,ecn_liquid_penetration_accessory,MeijerECN2012}. || The extracted spray boundaries represent the liquid-phase envelope observed in Mie imaging under a specific optical protocol, not the complete in-cylinder liquid-phase ground truth \cite{ecn_liquid_penetration,ecn_liquid_penetration_accessory}. || Thus, the derived penetration should be construed as the continuation of the Mie-defined geometric envelope, rather than direct evidence of a robust liquid-phase spray tip, localized liquid mass, droplet size, phase state, or the potential for wall film formation \cite{ecn_liquid_penetration,ecn_liquid_penetration_accessory}.	喷雾成像文献也表明，贯穿距离、锥角和边界位置并非脱离方法而存在的绝对真值， 而是由诊断方式、阈值规则和后处理定义共同生成的操作性观测量， 即依赖具体测量协议定义的可重复量，而非独立于方法的物理真值 \cite{MagnottiGenzale2013,JohnsonNaberLee2012,ecn_liquid_penetration,ecn_liquid_penetration_accessory}。 || Engine Combustion Network（ECN）的基准研究为这种方法依赖性提供了系统证据： 名义上相同喷油器（Spray~A 和 Spray~D）的跨机构比较揭示，液相贯穿距离的差散源于真实环境条件差异、不同光学设置（DBI 与 Mie）以及后处理阈值定义的共同作用 \cite{ecn_liquid_penetration,ecn_liquid_penetration_accessory,MeijerECN2012}。 || 提取的喷雾边界反映的是特定光学方案下米氏散射图像所呈现的液相包络，而非缸内液相分布的完整真值 \cite{ecn_liquid_penetration,ecn_liquid_penetration_accessory}。 || 因此，得到的贯穿距离应被理解为 Mie 定义的几何包络延续，而不是强液相喷雾尖端、局部液体质量、液滴尺寸、相态或壁膜形成潜力的直接证据 \cite{ecn_liquid_penetration,ecn_liquid_penetration_accessory}。	Supports the ECN definition and method-dependence of liquid-penetration measurements.	用于支撑 ECN 对液相穿深定义及其方法依赖性的说明。	Saved public HTML page from https://ecn.sandia.gov/diesel-spray-combustion/experimental-diagnostics/liquid-penetration-length/
ecn_liquid_penetration_accessory	Misc	true	Engine Combustion Network		Accessory Data Regarding Liquid Penetration and Extinction at Spray A Conditions							https://ecn.sandia.gov/accessory-data-reguarding-liquid-penetration-and-extinction-at-spray-a-conditions/			Accessed 30 March 2026	https://ecn.sandia.gov/accessory-data-reguarding-liquid-penetration-and-extinction-at-spray-a-conditions/	downloaded	reference_sources/ecn_liquid_penetration_accessory.html		sections_en/01_introduction_technical_backup.tex:78 || sections_en/02_literature_review.tex:63 || sections_en/06_discussion.tex:34 || sections_en/06_discussion.tex:45	sections_zh/01_introduction_technical_backup.tex:63 || sections_zh/02_literature_review.tex:65 || sections_zh/06_discussion.tex:33 || sections_zh/06_discussion.tex:43	\cite{MagnottiGenzale2013,JohnsonNaberLee2012,ecn_liquid_penetration,ecn_liquid_penetration_accessory}. || The Engine Combustion Network (ECN) benchmark studies provided systematic evidence for this methodological dependency: inter-facility comparisons of nominally identical injectors (Spray~A and Spray~D) revealed scatter in liquid-phase penetration arising from a combination of genuine ambient-condition differences, distinct optical setups (DBI versus Mie), and post-processing threshold definitions \cite{ecn_liquid_penetration,ecn_liquid_penetration_accessory,MeijerECN2012}. || The extracted spray boundaries represent the liquid-phase envelope observed in Mie imaging under a specific optical protocol, not the complete in-cylinder liquid-phase ground truth \cite{ecn_liquid_penetration,ecn_liquid_penetration_accessory}. || Thus, the derived penetration should be construed as the continuation of the Mie-defined geometric envelope, rather than direct evidence of a robust liquid-phase spray tip, localized liquid mass, droplet size, phase state, or the potential for wall film formation \cite{ecn_liquid_penetration,ecn_liquid_penetration_accessory}.	喷雾成像文献也表明，贯穿距离、锥角和边界位置并非脱离方法而存在的绝对真值， 而是由诊断方式、阈值规则和后处理定义共同生成的操作性观测量， 即依赖具体测量协议定义的可重复量，而非独立于方法的物理真值 \cite{MagnottiGenzale2013,JohnsonNaberLee2012,ecn_liquid_penetration,ecn_liquid_penetration_accessory}。 || Engine Combustion Network（ECN）的基准研究为这种方法依赖性提供了系统证据： 名义上相同喷油器（Spray~A 和 Spray~D）的跨机构比较揭示，液相贯穿距离的差散源于真实环境条件差异、不同光学设置（DBI 与 Mie）以及后处理阈值定义的共同作用 \cite{ecn_liquid_penetration,ecn_liquid_penetration_accessory,MeijerECN2012}。 || 提取的喷雾边界反映的是特定光学方案下米氏散射图像所呈现的液相包络，而非缸内液相分布的完整真值 \cite{ecn_liquid_penetration,ecn_liquid_penetration_accessory}。 || 因此，得到的贯穿距离应被理解为 Mie 定义的几何包络延续，而不是强液相喷雾尖端、局部液体质量、液滴尺寸、相态或壁膜形成潜力的直接证据 \cite{ecn_liquid_penetration,ecn_liquid_penetration_accessory}。	Supports the ECN caution that optical liquid boundaries depend on diagnostic and post-processing definitions.	用于支撑 ECN 关于光学液相边界依赖诊断和后处理定义的警示。	Saved public HTML page from https://ecn.sandia.gov/data/bkldaal1liquid/
liu2020sprayreview	Article	true	Liu, Long and Peng, Yan and Liu, Dai and Han, Changfu and Zhao, Ningbo and Ma, Xiuzhen	2020	A Review of Phenomenological Spray Penetration Modeling for Diesel Engines with Advanced Injection Strategy	International Journal of Spray and Combustion Dynamics		12			10.1177/1756827720934067					https://doi.org/10.1177/1756827720934067	manual_required		No clearly legal open PDF/HTML download was found automatically; use the DOI/URL manually or through institutional access if needed.	sections_en/01_introduction.tex:43 || sections_en/01_introduction_technical_backup.tex:61 || sections_en/01_introduction_technical_backup.tex:97 || sections_en/02_literature_review.tex:141	sections_zh/01_introduction.tex:43 || sections_zh/01_introduction_technical_backup.tex:51 || sections_zh/01_introduction_technical_backup.tex:79 || sections_zh/02_literature_review.tex:146	Recent studies show that neural networks can predict macroscopic spray characteristics, such as penetration and cone angle, leveraging operating conditions \cite{VazKarathanasis2026,liu2020sprayreview}. || High-fidelity CFD is information-rich, but it requires complex inputs, model tuning, and substantial computational resources; existing reacting diesel-spray LES studies show that a single higher-fidelity simulation can consume tens of thousands of CPU core-hours \cite{CurtisNiemeyerSung2017,liu2020sprayreview}. || Recent studies have shown that neural networks can predict macroscopic spray properties such as penetration and cone angle from operating-condition parameters, providing a predictive approach that is faster than high-fidelity CFD while more flexible than fixed-form empirical models \cite{VazKarathanasis2026,liu2020sprayreview}. || Internal nozzle flow under high pressure and potential cavitation further alter the jet structure and atomization state, mechanisms which classical penetration correlations do not attempt to characterize \cite{liu2020sprayreview}.	近期研究表明，神经网络可以根据工况参数预测贯穿距离和锥角等喷雾宏观特性 \cite{VazKarathanasis2026,liu2020sprayreview}。 || 高保真 CFD 信息丰富，但依赖复杂输入、模型调参与显著计算资源； 已有反应柴油喷雾 LES 研究显示，单次较高保真仿真即可消耗数万 CPU core-hours \cite{CurtisNiemeyerSung2017,liu2020sprayreview}。 || 近期研究表明，神经网络可以基于工况参数预测喷雾贯穿距离和锥角等宏观特性， 从而在完整 CFD 与经验模型之间形成快速预测层 \cite{VazKarathanasis2026,liu2020sprayreview}。 || 高压下的喷嘴内流动以及可能的空化还会进一步改变射流结构与雾化状态，而经典贯穿距离关联式并不试图刻画这些机制 \cite{liu2020sprayreview}。	Supports the review of phenomenological spray-penetration models and their limitations for advanced injection strategies.	用于支撑现象学穿深模型综述及其在先进喷射策略下的局限。	Checked direct URL, arXiv when applicable, and OpenAlex OA metadata.
