bib_key	entry_type	used_in_tex	authors	year	title	container	publisher_or_institution	volume	number	pages	doi	url	isbn	eprint	bib_note	source_link	download_status	downloaded_file_path	manual_reason	english_tex_locations	chinese_tex_locations	english_citation_sentences	chinese_citation_sentences	english_reference_meaning	chinese_reference_meaning	verification_notes
HeywoodICE	Book	true	Heywood, John B.	1988	Internal Combustion Engine Fundamentals		McGraw-Hill						978-0070286375				manual_required		No DOI or URL is present in the BibTeX entry; manual lookup is required.	sections_en/04_trajectory_surrogate_screening.tex:781	sections_zh/04_trajectory_surrogate_screening.tex:789	} The crown axial position follows the simplified slider-crank form \cite{HeywoodICE} \[ h_{\mathrm{crown}}(t)=h_{0}-\tfrac{s}{2}\cos(\omega t+\varphi),\qquad \omega=\tfrac{2\pi\,\mathrm{RPM}}{60}, \] implemented with \(t\) passed in seconds to the angular velocity term, while the GUI displays the time axis in milliseconds.	} 顶面轴向位置遵循简化的滑块-曲柄形式 \cite{HeywoodICE} \[ h_{\mathrm{crown}}(t)=h_{0}-\tfrac{s}{2}\cos(\omega t+\varphi),\qquad \omega=\tfrac{2\pi\,\mathrm{RPM}}{60}, \] 其中实现在将 \(t\) 以秒为单位传递给角速度项时，GUI以毫秒显示时间轴。	General internal-combustion-engine reference; specifically cited for the slider-crank piston-kinematics idealisation used in the prototype wall-impingement geometry.	通用内燃机基础参考；本文具体用于原型撞壁几何中活塞滑块--曲柄运动学近似的依据。	No machine-resolvable link in BibTeX.
Linne2013SprayImaging	Article	true	Linne, M.	2013	Imaging in the optically dense regions of a spray: A review of developing techniques	Progress in Energy and Combustion Science		39	5	403-440	10.1016/j.pecs.2013.06.001					https://doi.org/10.1016/j.pecs.2013.06.001	manual_required		No clearly legal open PDF/HTML download was found automatically; use the DOI/URL manually or through institutional access if needed.	sections_en/01_introduction.tex:28 || sections_en/01_introduction_technical_backup.tex:55 || sections_en/02_literature_review.tex:19 || sections_en/02_literature_review.tex:22 || sections_en/02_literature_review.tex:34 || sections_en/02_literature_review.tex:36 || sections_en/02_literature_review.tex:47 || sections_en/02_literature_review.tex:48 || sections_en/02_literature_review.tex:52 || sections_en/03_data_workflow.tex:191 || sections_en/03_data_workflow.tex:222 || sections_en/03_data_workflow.tex:502	sections_zh/01_introduction.tex:28 || sections_zh/01_introduction_technical_backup.tex:45 || sections_zh/02_literature_review.tex:21 || sections_zh/02_literature_review.tex:24 || sections_zh/02_literature_review.tex:36 || sections_zh/02_literature_review.tex:38 || sections_zh/02_literature_review.tex:50 || sections_zh/02_literature_review.tex:51 || sections_zh/02_literature_review.tex:55 || sections_zh/03_data_workflow.tex:190 || sections_zh/03_data_workflow.tex:221 || sections_zh/03_data_workflow.tex:497	Optical spray experiments offer a complementary pathway, yielding reproducible observations of the liquid-phase envelope; among these, high-speed Mie scattering imaging is particularly well-suited for examining liquid boundaries and macroscopic penetration evolution \cite{Linne2013SprayImaging}. || Among these techniques, high-speed Mie imaging is especially suitable for observing liquid-phase boundaries and macroscopic penetration evolution \cite{Linne2013SprayImaging}. || Mie scattering is widely used for dense liquid-phase spray visualization, a primary reason being its relatively concise experimental implementation; compared to many alternative diagnostic techniques, Mie imaging is easier to integrate with high-speed photography platforms, thereby achieving high temporal resolution \cite{Linne2013SprayImaging}. || Its scattering response depends on droplet size distribution, number density, refractive index, wavelength, scattering angle relative to the illumination direction, and path length through the spray volume; in dense regions, multiple scattering and shadowing effects further alter the image intensity distribution \cite{BohrenHuffman2004,Linne2013SprayImaging}. || While all these methods have their respective values, their alignment with the target observables differs for the non-evaporating, non-reacting liquid-phase diesel sprays focused on in this thesis: LIF, PIV, and PDPA lean toward component, flow field, or single-point size-velocity measurements, which struggle to directly support the high-temporal-resolution liquid-phase envelope tracking required here; Although Schlieren and Shadowgraph can provide spray shape information, their specificity for liquid-phase boundaries is not as explicit as that of droplet scattering methods; DBI and Mie are much closer to the tasks of extracting liquid-phase contours, penetration, and cone angles that this thesis concerns \cite{Linne2013SprayImaging}. || Volume-illuminated Mie imaging instead operates with continuous illumination, shifting the temporal-resolution burden from the laser onto the high-speed camera and avoiding the cost of a high-repetition-rate pulsed laser system altogether \cite{Linne2013SprayImaging}. || Based on the aforementioned methodological attributes, this thesis does not interpret pixel intensities as thermodynamic ground truths for direct inversion, but rather treats them as geometric cues for the liquid-phase boundaries; The image processing objectives are explicitly restricted to extracting operational observables such as penetration, cone angle, projected area, and boundary positions, as such geometric descriptions are more defensible than claims of precise liquid-phase distributions \cite{Linne2013SprayImaging,LefebvreMcDonell2017}. || Among these, penetration is the core input for subsequent trajectory fitting, surrogate modeling, and wall-impingement risk screening \cite{Linne2013SprayImaging,LefebvreMcDonell2017,Dent1971Penetration,HiroyasuArai1990,NaberSiebers1996}. || Mie imaging also carries a characteristic physical limitation of multiple scattering: In the dense liquid core region near the nozzle, the high droplet number density produces intense forward-scattered and wide-angle scattered light that redistributes intensity spatially, blurring the sharp liquid-phase boundary and producing a diffuse halo rather than a clear edge \cite{BohrenHuffman2004,Linne2013SprayImaging,Berrocal2007MultipleScattering}. || This sequence is critical for Mie videos, as the raw intensity is not a direct measure of liquid volume fraction; the actual goal is to stably extract geometry under non-uniform illumination, glare, and background textures, rather than performing a rigorous optical inversion \cite{BohrenHuffman2004,Linne2013SprayImaging,GonzalezWoodsDIP}. || Quantitative computations use a robust background estimation from pre-injection statistics, and convert the representation into an edge-dominant Sobel feature space, ensuring the geometric response is dictated by fixed operators and local boundary structures rather than display brightness \cite{BohrenHuffman2004,Linne2013SprayImaging,GonzalezWoodsDIP}. || These metrics are important because they compress each aligned strip into a compact geometric state vector; however, the downstream modeling in this work remains centered on penetration, as it is the most well-supported target in existing analyses \cite{Linne2013SprayImaging,LefebvreMcDonell2017}.	光学喷雾实验则提供了互补路径，能够给出可重复的液相包络观测；其中，高速 Mie 成像尤其适合观察液相边界和宏观贯穿距离演化 \cite{Linne2013SprayImaging}。 || 与此同时，光学喷雾实验能够在受控环境下提供可重复、可横向比较的液相包络证据， 高速 Mie 成像尤其适合观察液相边界和宏观贯穿距离演化 \cite{Linne2013SprayImaging}。 || Mie 散射被广泛用于致密液相喷雾可视化，一个重要原因在于其实验实现相对简洁； 与许多替代诊断手段相比，Mie 成像更易与高速摄影平台结合，从而获得较高时间分辨率 \cite{Linne2013SprayImaging}。 || 其散射响应取决于液滴粒径分布、数密度、折射率、波长、相对于照明方向的散射角以及穿越喷雾体的路径长度；在致密区域中，多重散射和阴影效应还会进一步改变图像强度分布 \cite{BohrenHuffman2004,Linne2013SprayImaging}。 || 这些方法均具有各自价值，但对于本文关注的非蒸发、非反应液相柴油喷雾而言，它们与目标观测量的匹配程度并不相同： LIF、PIV 和 PDPA 更偏向组分、流场或单点粒径速度测量，难以直接支撑本文所需的高时间分辨率液相包络追踪； Schlieren 与 Shadowgraph 虽可提供喷雾外形信息，但对液相边界的针对性不如液滴散射类方法明确； DBI 与 Mie 则更接近本文关心的液相轮廓、贯穿距离与锥角提取任务 \cite{Linne2013SprayImaging}。 || 体照明 Mie 成像则可在连续照明下工作，将时间分辨率的负担从激光器转移到高速相机上，从而完全避免了高重频脉冲激光系统的高昂成本 \cite{Linne2013SprayImaging}。 || 基于上述方法属性，本文不将像素强度解释为可直接反演的热力学真值，而是将其作为液相边界的几何线索； 图像处理目标也被明确限定为提取贯穿距离、锥角、投影面积和边界位置等操作性观测量，这类几何描述比精确液相分布的主张更可辩护 \cite{Linne2013SprayImaging,LefebvreMcDonell2017}。 || 其中，贯穿距离是后续轨迹拟合、代理模型建模与撞壁风险筛查的核心输入 \cite{Linne2013SprayImaging,LefebvreMcDonell2017,Dent1971Penetration,HiroyasuArai1990,NaberSiebers1996}。 || Mie 成像还带有一个特征性的多重散射物理限制： 在喷嘴附近的致密液核区域，高液滴数密度产生强烈的前向散射和大角度散射光，在空间上重新分配强度，模糊了清晰的液相边界，从而产生弥散光晕而非清晰边缘 \cite{BohrenHuffman2004,Linne2013SprayImaging,Berrocal2007MultipleScattering}。 || 这一序列对 Mie 视频很重要，因为原始强度并不是液体体积分数的直接度量，而实际目标是在非均匀照明、眩光和背景纹理下稳定提取几何，而不是做精确光学反演 \cite{BohrenHuffman2004,Linne2013SprayImaging,GonzalezWoodsDIP}。 || 定量计算则使用喷射前统计得到的稳健背景估计，再把表示转换成边缘主导的 Sobel 特征，使几何响应主要由固定算子和局部边界结构决定，而不是由显示亮度决定 \cite{BohrenHuffman2004,Linne2013SprayImaging,GonzalezWoodsDIP}。 || 这些度量之所以重要，是因为它们把每条对齐后的条带压缩成一个紧凑的几何状态向量；不过，本文的下游建模仍然以穿深为中心，因为在现有分析里它是支持最充分的目标 \cite{Linne2013SprayImaging,LefebvreMcDonell2017}。	Supports the limits and usefulness of optical spray imaging and Mie-scattering diagnostics for extracting liquid-envelope observables.	用于支撑光学喷雾成像和 Mie 散射诊断的适用性及局限，说明液相包络只能作为操作性观测量解释。	Checked direct URL, arXiv when applicable, and OpenAlex OA metadata.
BohrenHuffman2004	Book	true	Bohren, Craig F. and Huffman, Donald R.	2004	Absorption and Scattering of Light by Small Particles		Wiley-VCH						9783527409969				manual_required		No DOI or URL is present in the BibTeX entry; manual lookup is required.	sections_en/02_literature_review.tex:22 || sections_en/02_literature_review.tex:52 || sections_en/03_data_workflow.tex:191 || sections_en/03_data_workflow.tex:222	sections_zh/02_literature_review.tex:24 || sections_zh/02_literature_review.tex:55 || sections_zh/03_data_workflow.tex:190 || sections_zh/03_data_workflow.tex:221	Its scattering response depends on droplet size distribution, number density, refractive index, wavelength, scattering angle relative to the illumination direction, and path length through the spray volume; in dense regions, multiple scattering and shadowing effects further alter the image intensity distribution \cite{BohrenHuffman2004,Linne2013SprayImaging}. || Mie imaging also carries a characteristic physical limitation of multiple scattering: In the dense liquid core region near the nozzle, the high droplet number density produces intense forward-scattered and wide-angle scattered light that redistributes intensity spatially, blurring the sharp liquid-phase boundary and producing a diffuse halo rather than a clear edge \cite{BohrenHuffman2004,Linne2013SprayImaging,Berrocal2007MultipleScattering}. || This sequence is critical for Mie videos, as the raw intensity is not a direct measure of liquid volume fraction; the actual goal is to stably extract geometry under non-uniform illumination, glare, and background textures, rather than performing a rigorous optical inversion \cite{BohrenHuffman2004,Linne2013SprayImaging,GonzalezWoodsDIP}. || Quantitative computations use a robust background estimation from pre-injection statistics, and convert the representation into an edge-dominant Sobel feature space, ensuring the geometric response is dictated by fixed operators and local boundary structures rather than display brightness \cite{BohrenHuffman2004,Linne2013SprayImaging,GonzalezWoodsDIP}.	其散射响应取决于液滴粒径分布、数密度、折射率、波长、相对于照明方向的散射角以及穿越喷雾体的路径长度；在致密区域中，多重散射和阴影效应还会进一步改变图像强度分布 \cite{BohrenHuffman2004,Linne2013SprayImaging}。 || Mie 成像还带有一个特征性的多重散射物理限制： 在喷嘴附近的致密液核区域，高液滴数密度产生强烈的前向散射和大角度散射光，在空间上重新分配强度，模糊了清晰的液相边界，从而产生弥散光晕而非清晰边缘 \cite{BohrenHuffman2004,Linne2013SprayImaging,Berrocal2007MultipleScattering}。 || 这一序列对 Mie 视频很重要，因为原始强度并不是液体体积分数的直接度量，而实际目标是在非均匀照明、眩光和背景纹理下稳定提取几何，而不是做精确光学反演 \cite{BohrenHuffman2004,Linne2013SprayImaging,GonzalezWoodsDIP}。 || 定量计算则使用喷射前统计得到的稳健背景估计，再把表示转换成边缘主导的 Sobel 特征，使几何响应主要由固定算子和局部边界结构决定，而不是由显示亮度决定 \cite{BohrenHuffman2004,Linne2013SprayImaging,GonzalezWoodsDIP}。	Provides the scattering-physics basis for explaining why Mie intensity is not a direct liquid-volume-fraction measurement.	用于说明散射物理基础，支撑 Mie 强度不能直接等同于液体体积分数的论述。	No machine-resolvable link in BibTeX.
Pickett2011DBISAEref	InProceedings	true	Pickett, Lyle M. and Genzale, Caroline L. and Manin, Julien and Malbec, Louis-Marie and Hermant, Laurent	2011	Measurement Uncertainty of Liquid Penetration in Evaporating Diesel Sprays	Proceedings of the ILASS Americas 23rd Annual Conference on Liquid Atomization and Spray Systems									Paper ILASS2011-111		manual_required		No DOI is present in the BibTeX entry; use the ECN page or ILASS proceedings record manually if needed.	sections_en/02_literature_review.tex:26	sections_zh/02_literature_review.tex:28	DBI (Diffuse Background Illumination) measures path-integrated extinction by applying the Beer--Lambert law to a spatially uniform diffuse transmitted-light field, yielding a measurement proportional to the liquid volume fraction integrated along the line of sight, and is typically suitable for extracting liquid-phase contours \cite{Pickett2011DBISAEref}; Schlieren responds to the first spatial derivative of the refractive index field, while Shadowgraph responds to its second derivative (the Laplacian); both can image liquid-spray boundaries through the refractive index discontinuity at the liquid–gas interface, but their signals are simultaneously modulated by gas-phase density gradients and vapour-phase distributions in evaporating conditions, making it harder to isolate the pure liquid-phase boundary compared to droplet scattering methods; LIF characterizes vapor distribution or equivalence ratio through fuel or tracer fluorescence (liquid-phase LIF and exciplex techniques can also separate liquid and vapor contributions \cite{Suzuki1990}, but both require fluorescent additives or dedicated tracer compounds that impose chemical compatibility constraints, which effectively precludes their use with commercial diesel in facilities such as the OSCC); PIV focuses on velocity fields and turbulent structures; PDPA provides single-point droplet size and velocity information; reconstructing a two-dimensional spray envelope requires spatial scanning, making it unsuitable for instantaneous full-field multi-plume characterisation.	DBI（漫反射背光成像）通过将 Beer--Lambert 定律应用于空间均匀的漫透射光场来测量路径积分消光，给出沿视线积分的液体体积分数，通常适合提取液相轮廓 \cite{Pickett2011DBISAEref}； Schlieren 响应折射率场的一阶空间导数，Shadowgraph 响应其二阶导数（Laplacian）；两者均可通过液气界面处的折射率不连续性成像液相喷雾边界，但其信号同时受气相密度梯度以及蒸发工况下蒸汽相分布的调制，使得与液滴散射类方法相比，对纯液相边界的针对性更弱； LIF 通过燃料或示踪剂荧光表征蒸汽分布或当量比（液相 LIF 和双分子荧光技术可同时分辨液相与气相贡献 \cite{Suzuki1990}，但两者均需荧光添加剂或专用示踪剂，会对测试流体产生化学相容性约束，在 OSCC 等使用商用柴油的设施中实际不可行）； PIV 关注速度场与湍流结构； PDPA 则提供单点液滴粒径与速度信息；重建二维喷雾包络需要空间扫描，不适合瞬态全场多孔喷油束表征。	Supports DBI/extinction-based liquid-penetration and liquid-length diagnostics for evaporating diesel sprays.	用于支撑基于 DBI/消光成像的蒸发柴油喷雾液相穿深与液相长度诊断。	Verified via the Engine Combustion Network references and liquid-length diagnostics page; ECN lists Pickett, Genzale, Manin, Malbec, and Hermant, ILASS Americas 2011, and identifies DBI as a diffused back-illumination extinction diagnostic.
Suzuki1990	TechReport	true	Suzuki, Mamoru and Nishida, Keiya and Hiroyasu, Hiroyuki	1993	Simultaneous Concentration Measurement of Vapor and Liquid in an Evaporating Diesel Spray		SAE International		930863		10.4271/930863					https://doi.org/10.4271/930863	manual_required		No clearly legal open PDF/HTML download was found automatically; use the DOI/URL manually or through institutional access if needed.	sections_en/02_literature_review.tex:28	sections_zh/02_literature_review.tex:30	DBI (Diffuse Background Illumination) measures path-integrated extinction by applying the Beer--Lambert law to a spatially uniform diffuse transmitted-light field, yielding a measurement proportional to the liquid volume fraction integrated along the line of sight, and is typically suitable for extracting liquid-phase contours \cite{Pickett2011DBISAEref}; Schlieren responds to the first spatial derivative of the refractive index field, while Shadowgraph responds to its second derivative (the Laplacian); both can image liquid-spray boundaries through the refractive index discontinuity at the liquid–gas interface, but their signals are simultaneously modulated by gas-phase density gradients and vapour-phase distributions in evaporating conditions, making it harder to isolate the pure liquid-phase boundary compared to droplet scattering methods; LIF characterizes vapor distribution or equivalence ratio through fuel or tracer fluorescence (liquid-phase LIF and exciplex techniques can also separate liquid and vapor contributions \cite{Suzuki1990}, but both require fluorescent additives or dedicated tracer compounds that impose chemical compatibility constraints, which effectively precludes their use with commercial diesel in facilities such as the OSCC); PIV focuses on velocity fields and turbulent structures; PDPA provides single-point droplet size and velocity information; reconstructing a two-dimensional spray envelope requires spatial scanning, making it unsuitable for instantaneous full-field multi-plume characterisation.	DBI（漫反射背光成像）通过将 Beer--Lambert 定律应用于空间均匀的漫透射光场来测量路径积分消光，给出沿视线积分的液体体积分数，通常适合提取液相轮廓 \cite{Pickett2011DBISAEref}； Schlieren 响应折射率场的一阶空间导数，Shadowgraph 响应其二阶导数（Laplacian）；两者均可通过液气界面处的折射率不连续性成像液相喷雾边界，但其信号同时受气相密度梯度以及蒸发工况下蒸汽相分布的调制，使得与液滴散射类方法相比，对纯液相边界的针对性更弱； LIF 通过燃料或示踪剂荧光表征蒸汽分布或当量比（液相 LIF 和双分子荧光技术可同时分辨液相与气相贡献 \cite{Suzuki1990}，但两者均需荧光添加剂或专用示踪剂，会对测试流体产生化学相容性约束，在 OSCC 等使用商用柴油的设施中实际不可行）； PIV 关注速度场与湍流结构； PDPA 则提供单点液滴粒径与速度信息；重建二维喷雾包络需要空间扫描，不适合瞬态全场多孔喷油束表征。	Supports simultaneous vapor/liquid concentration measurement in evaporating diesel sprays; note that the verified Suzuki source is a laser absorption/scattering SAE paper rather than a 1990 LIF paper.	用于支撑蒸发柴油喷雾中气相与液相浓度的同步测量；注意已核实的 Suzuki 来源是 1993 年 SAE 激光吸收/散射论文，并非 1990 年 LIF 论文。	Verified via SAE Mobilus metadata and J-STAGE related publication metadata. The existing key name is kept for LaTeX compatibility, but the verified publication year is 1993 and the authors are Mamoru Suzuki, Keiya Nishida, and Hiroyuki Hiroyasu.
Berrocal2007MultipleScattering	Article	true	Berrocal, Edouard and Sedarsky, David and Paciaroni, Megan and Meglinski, Igor V. and Linne, Mark	2007	Laser Light Scattering in Turbid Media Part I: Experimental and Simulated Results for the Spatial Intensity Distribution	Optics Express		15	17	10649-10665	10.1364/OE.15.010649					https://doi.org/10.1364/OE.15.010649	manual_required		No clearly legal open PDF/HTML download was found automatically; use the DOI/URL manually or through institutional access if needed.	sections_en/02_literature_review.tex:52	sections_zh/02_literature_review.tex:55	Mie imaging also carries a characteristic physical limitation of multiple scattering: In the dense liquid core region near the nozzle, the high droplet number density produces intense forward-scattered and wide-angle scattered light that redistributes intensity spatially, blurring the sharp liquid-phase boundary and producing a diffuse halo rather than a clear edge \cite{BohrenHuffman2004,Linne2013SprayImaging,Berrocal2007MultipleScattering}.	Mie 成像还带有一个特征性的多重散射物理限制： 在喷嘴附近的致密液核区域，高液滴数密度产生强烈的前向散射和大角度散射光，在空间上重新分配强度，模糊了清晰的液相边界，从而产生弥散光晕而非清晰边缘 \cite{BohrenHuffman2004,Linne2013SprayImaging,Berrocal2007MultipleScattering}。	Supports the multiple-scattering explanation for diffuse halos and degraded boundary contrast in optically dense spray imaging.	用于支撑光学致密喷雾中多重散射会造成弥散光晕并降低边界清晰度的解释。	Verified via Optica/Optics Express metadata and Lund University publication record; DOI, journal, volume, issue, pages, year, and authors confirmed.
