bib_key	entry_type	used_in_tex	authors	year	title	container	publisher_or_institution	volume	number	pages	doi	url	isbn	eprint	bib_note	source_link	download_status	downloaded_file_path	manual_reason	english_tex_locations	chinese_tex_locations	english_citation_sentences	chinese_citation_sentences	english_reference_meaning	chinese_reference_meaning	verification_notes
ChengAhmadGrahn2023	Article	true	Cheng, Qiang and Ahmad, Zeeshan and Grahn, Viljam and Hyvonen, Jari and Kaario, Ossi and Larmi, Martti	2023	Optical Investigation of the Diesel Spray Characteristics and Spray Geometry Prediction Model by Artificial Neural Network	SAE Technical Papers					10.4271/2023-01-0302					https://doi.org/10.4271/2023-01-0302	manual_required		No clearly legal open PDF/HTML download was found automatically; use the DOI/URL manually or through institutional access if needed.	sections_en/02_literature_review.tex:218	sections_zh/02_literature_review.tex:224	utilized artificial neural networks to predict key geometric parameters of multi-hole nozzle sprays; their data inherently included penetration, cone angle, spray tip velocity, area, as well as plume-to-plume and shot-to-shot variations, thus it can be viewed as an experimental ANN surrogate model closely aligned with the problem in this thesis \cite{ChengAhmadGrahn2023}.	Cheng 等基于恒容喷雾室中的高速 Mie 散射实验数据，利用人工神经网络预测多孔喷嘴喷雾的几何关键参数； 其数据本身已经包含 penetration、cone angle、spray tip velocity、area 以及 plume-to-plume 和 shot-to-shot 变化，因此可视为与本文问题较为接近的一类实验型 ANN 代理模型 \cite{ChengAhmadGrahn2023}。	Experimental ANN surrogate predicting multi-hole nozzle spray geometry from Mie data; the closest prior work to this thesis's data-driven penetration surrogate.	基于 Mie 数据预测多孔喷嘴喷雾几何的实验型 ANN 代理，是与本文数据驱动贯穿距离代理最接近的先前工作。	Checked direct URL, arXiv when applicable, and OpenAlex OA metadata.
ZhangWuXu2024	Article	true	Zhang, Yifei and Zhang, Gengxin and Wu, Dawei and Wang, Qian and Nadimi, Ebrahim and Shi, Penghua and Xu, Hongming	2024	Parameter Sensitivity Analysis for Diesel Spray Penetration Prediction Based on GA-BP Neural Network	Energy and AI		18		100443	10.1016/j.egyai.2024.100443					https://doi.org/10.1016/j.egyai.2024.100443	manual_required		No clearly legal open PDF/HTML download was found automatically; use the DOI/URL manually or through institutional access if needed.	sections_en/02_literature_review.tex:219	sections_zh/02_literature_review.tex:225	subsequently constructed a GA-BP neural network using experimental diesel spray penetration data and reported that its prediction accuracy surpassed traditional empirical formulas \cite{ZhangWuXu2024}.	Zhang 等随后使用实验柴油喷雾贯穿距离数据构建 GA-BP 神经网络，并报告其预测精度优于传统经验公式 \cite{ZhangWuXu2024}。	GA-BP neural network for diesel-spray penetration reported to surpass classical empirical formulas; evidence that compact regressors can predict penetration.	用于柴油喷雾贯穿距离的 GA-BP 神经网络，据报优于经典经验公式，佐证紧凑回归器可预测贯穿距离。	Checked direct URL, arXiv when applicable, and OpenAlex OA metadata.
VazKarathanasis2026	Article	true	Justino Vaz, Marilia Gabriela and Karathanassis, Ioannis K. and Gavaises, Manolis and Mouokue, Gerard	2026	Data-Driven Prediction of Spray Macroscopic Characteristics for Marine Injectors Using Neural Networks	Fuel		405		136736	10.1016/j.fuel.2025.136736					https://doi.org/10.1016/j.fuel.2025.136736	downloaded	reference_sources/VazKarathanasis2026.pdf		sections_en/01_introduction.tex:43 || sections_en/01_introduction_technical_backup.tex:97 || sections_en/02_literature_review.tex:220	sections_zh/01_introduction.tex:43 || sections_zh/01_introduction_technical_backup.tex:79 || sections_zh/02_literature_review.tex:226	Recent studies show that neural networks can predict macroscopic spray characteristics, such as penetration and cone angle, leveraging operating conditions \cite{VazKarathanasis2026,liu2020sprayreview}. || Recent studies have shown that neural networks can predict macroscopic spray properties such as penetration and cone angle from operating-condition parameters, providing a predictive approach that is faster than high-fidelity CFD while more flexible than fixed-form empirical models \cite{VazKarathanasis2026,liu2020sprayreview}. || further used neural networks to directly predict spray penetration and cone angle from operating and geometric parameters, supporting rapid design space exploration for marine injectors \cite{VazKarathanasis2026}.	近期研究表明，神经网络可以根据工况参数预测贯穿距离和锥角等喷雾宏观特性 \cite{VazKarathanasis2026,liu2020sprayreview}。 || 近期研究表明，神经网络可以基于工况参数预测喷雾贯穿距离和锥角等宏观特性， 从而在完整 CFD 与经验模型之间形成快速预测层 \cite{VazKarathanasis2026,liu2020sprayreview}。 || 在更接近船用喷油器设计筛查的场景中，Vaz 等进一步使用神经网络由工况参数和几何参数直接预测喷雾贯穿距离与锥角，以支持海用喷油器的快速设计空间探索 \cite{VazKarathanasis2026}。	Supports the feasibility of data-driven neural-network prediction of marine-injector spray macroscopic characteristics.	用于支撑神经网络预测船用喷嘴宏观喷雾特性的可行性。	Downloaded legal open PDF from https://openaccess.city.ac.uk/id/eprint/35823/1/1-s2.0-S0016236125024615-main.pdf
KangKang2024KDRegression	Article	true	Kang, Myeonginn and Kang, Seokho	2024	Knowledge Distillation with Insufficient Training Data for Regression	Engineering Applications of Artificial Intelligence		132		108001	10.1016/j.engappai.2024.108001					https://doi.org/10.1016/j.engappai.2024.108001	manual_required		No clearly legal open PDF/HTML download was found automatically; use the DOI/URL manually or through institutional access if needed.	sections_en/02_literature_review.tex:347	sections_zh/02_literature_review.tex:354	Kang and Kang (2024) showed specifically for regression tasks that teacher-generated soft targets substantially reduce student errors in under-labelled regions \cite{KangKang2024KDRegression}, which provides direct empirical support for the distillation design adopted here.	Kang 和 Kang（2024）专门针对回归任务证明了教师生成的软目标能在标签稀缺区域显著降低学生误差 \cite{KangKang2024KDRegression}，为本文采用的蒸馏设计提供了直接实证支撑。	Supports knowledge distillation specifically in regression with insufficient training data.	用于支撑训练数据不足时在回归任务中采用知识蒸馏。	Checked direct URL, arXiv when applicable, and OpenAlex OA metadata.
Baumgarten2006MixFormation	Book	true	Baumgarten, Carsten	2006	Mixture Formation in Internal Combustion Engines		Springer				10.1007/3-540-30836-9					https://doi.org/10.1007/3-540-30836-9	manual_required		No clearly legal open PDF/HTML download was found automatically; use the DOI/URL manually or through institutional access if needed.	sections_en/01_introduction.tex:26 || sections_en/01_introduction_technical_backup.tex:51 || sections_en/02_literature_review.tex:434 || sections_en/02_literature_review.tex:435	sections_zh/01_introduction.tex:26 || sections_zh/01_introduction_technical_backup.tex:43 || sections_zh/02_literature_review.tex:447 || sections_zh/02_literature_review.tex:449	Empirical penetration correlations and phenomenological models can rapidly describe spray development; comparing penetration length against wall distance naturally yields a geometric criterion for first-order wall impingement screening \cite{HiroyasuArai1990,NaberSiebers1996,Baumgarten2006MixFormation}. || Empirical penetration correlations and phenomenological models have also long been employed in diesel-spray research to describe spray development rapidly; in this context, comparing penetration with wall distance provides a natural first-order geometric criterion for impingement screening \cite{HiroyasuArai1990,NaberSiebers1996,Baumgarten2006MixFormation}. || In engineering, the most direct screening rule is relatively clear: compare the liquid tip penetration $S_\mathrm{tip}(t)$ with the distance from the nozzle to the wall $L_\mathrm{wall}$; when \(S_\mathrm{tip}(t) \geq L_\mathrm{wall}\), it is flagged as an impingement \cite{Baumgarten2006MixFormation}. || In Baumgarten's systematic treatise on mixture formation in internal combustion engines, penetration correlations are treated as baseline tools for simplifying spray trajectories, and the comparison of penetration with wall distance serves as the first-order impingement criterion \cite{Baumgarten2006MixFormation}.	经验贯穿距离关联式和现象学模型可快速描述喷雾发展，将贯穿距离与壁距比较则构成了一阶撞壁筛查的自然几何判据 \cite{HiroyasuArai1990,NaberSiebers1996,Baumgarten2006MixFormation}。 || 柴油喷雾研究也长期使用经验贯穿距离关联式和现象学模型快速描述喷雾发展， 其中贯穿距离与壁距的比较构成了一阶撞壁筛查的自然几何判据 \cite{HiroyasuArai1990,NaberSiebers1996,Baumgarten2006MixFormation}。 || 工程上最直接的筛查规则相对明确： 比较液相尖端贯穿距离 $S_\mathrm{tip}(t)$ 与喷嘴到壁面的距离 $L_\mathrm{wall}$，当 \(S_\mathrm{tip}(t) \geq L_\mathrm{wall}\) 时标记为撞壁 \cite{Baumgarten2006MixFormation}。 || Baumgarten 关于内燃机混合气形成的系统论述中，也把贯穿距离关联式视为简化喷雾轨迹的基线工具，并把贯穿距离与壁距比较作为一阶撞壁判据 \cite{Baumgarten2006MixFormation}。	Supports the first-level wall-impingement criterion that compares spray-tip penetration with wall distance.	用于支撑将喷雾尖端穿深与壁距比较作为一级撞壁筛查准则。	Checked direct URL, arXiv when applicable, and OpenAlex OA metadata.
MorieiraMotaPanao2010	Article	true	Moreira, A. L. N. and Moita, A. S. and Panao, M. R.	2010	Advances and Challenges in Explaining Fuel Spray Impingement: How Much of Single Droplet Impact Research Is Useful?	Progress in Energy and Combustion Science		36	5	554-580	10.1016/j.pecs.2010.01.002					https://doi.org/10.1016/j.pecs.2010.01.002	manual_required		No clearly legal open PDF/HTML download was found automatically; use the DOI/URL manually or through institutional access if needed.	sections_en/01_introduction.tex:20 || sections_en/01_introduction_technical_backup.tex:36 || sections_en/02_literature_review.tex:425 || sections_en/02_literature_review.tex:428 || sections_en/06_discussion.tex:55	sections_zh/01_introduction.tex:20 || sections_zh/01_introduction_technical_backup.tex:33 || sections_zh/02_literature_review.tex:435 || sections_zh/02_literature_review.tex:439 || sections_zh/06_discussion.tex:53	If the liquid-phase envelope reaches the piston crown or cylinder liner prior to the formation of an effective ignition kernel, it may induce wall wetting, lubricating oil dilution, deteriorated mixture preparation, and elevated unburned hydrocarbon emissions \cite{peraza2022swi,ahmad2025fueldilution,MorieiraMotaPanao2010}. || If its liquid envelope reaches the piston crown or cylinder wall before a useful ignition kernel forms, wall wetting, lube-oil dilution, degraded mixture preparation, and increased unburned-hydrocarbon emissions may follow \cite{peraza2022swi,ahmad2025fueldilution,MorieiraMotaPanao2010}. || If liquid fuel reaches the piston crown or cylinder wall before evaporating or igniting, a fuel film may form on the wall, leading to wall wetting, localized mixing deterioration, elevated unburned hydrocarbon emissions, and lube oil dilution \cite{peraza2022swi,ahmad2025fueldilution,MorieiraMotaPanao2010}. || note in their review that while single droplet impact studies have indeed accumulated a wealth of fundamental knowledge, directly extrapolating it to continuous spray impingement is unsafe, because the collective behavior of a spray plume is further modulated by adjacent droplet interactions, residual wall films, and secondary atomization \cite{MorieiraMotaPanao2010}. || What truly warrants prioritized attention is direct liquid droplet impingement and continuous wall film formation \cite{MorieiraMotaPanao2010,liu2024marine_impingement,peraza2022swi,ahmad2025fueldilution}.	若液相包络在形成有效点火核之前到达活塞顶或缸壁，可能导致壁面润湿、润滑油稀释、混合准备恶化以及未燃碳氢排放升高 \cite{peraza2022swi,ahmad2025fueldilution,MorieiraMotaPanao2010}。 || 若液相包络在形成有效点火核之前已触及活塞顶或缸壁， 则可能导致壁面润湿、润滑油稀释、局部混合恶化以及未燃碳氢排放升高等不利后果 \cite{peraza2022swi,ahmad2025fueldilution,MorieiraMotaPanao2010}。 || 若液态燃料在蒸发或点火之前到达活塞顶或缸壁，壁面上可能形成燃油液膜，并造成壁面润湿、局部混合恶化、未燃碳氢排放升高以及机油稀释 \cite{peraza2022swi,ahmad2025fueldilution,MorieiraMotaPanao2010}。 || Moreira 等在综述中指出，单液滴撞击研究确实积累了大量基础知识， 但将其直接外推至连续喷雾撞壁并不稳妥，因为喷雾 plume 的集体行为还受到邻近液滴相互作用、残余壁膜和二次雾化等因素调制 \cite{MorieiraMotaPanao2010}。 || 真正需要优先关注的是直接液滴撞壁和持续壁膜形成 \cite{MorieiraMotaPanao2010,liu2024marine_impingement,peraza2022swi,ahmad2025fueldilution}。	Supports the broader spray-impingement physics context and the difficulty of scaling droplet-impact knowledge to full sprays.	用于支撑喷雾撞壁物理背景，以及从单液滴碰壁推广到整体喷雾的困难。	Checked direct URL, arXiv when applicable, and OpenAlex OA metadata.
Park2018WallImpingement	Article	true	Park, Junkyu and Kim, Taehoon and Kim, Donghwan and Park, Sungwook	2018	Prediction of Wall Impingement in a Direct Injection Spark Ignition Engine by Analyzing Spray Images for High-Pressure Injection up to 50 MPa	Fuel Processing Technology		179		238-249	10.1016/j.fuproc.2018.07.002					https://doi.org/10.1016/j.fuproc.2018.07.002	manual_required		No clearly legal open PDF/HTML download was found automatically; use the DOI/URL manually or through institutional access if needed.	sections_en/02_literature_review.tex:440	sections_zh/02_literature_review.tex:455	reconstructed the radial fuel mass distribution from spray images, and combined it with injection timing to estimate the mass fraction of fuel impinging on the piston and cylinder wall; their trend conclusion---that impingement quantity decreases as injection pressure rises and atomization improves---is not surprising in itself; what is more valuable is its methodological implication: image analysis can provide quantitative impingement estimations without running full CFD \cite{Park2018WallImpingement}.	Park 等针对高压汽油直喷，从喷雾图像重建径向燃油质量分布， 并结合喷射时序估算撞击活塞和缸壁的燃油质量份额； 其趋势结论，即喷射压力升高、雾化增强时撞壁量下降，本身并不意外，更有价值的是其方法论含义： 图像分析可以在不进行完整 CFD 的条件下给出定量撞壁估计 \cite{Park2018WallImpingement}。	Supports image-based wall-impingement prediction as a lower-cost alternative to full CFD.	用于支撑基于图像分析进行撞壁预测可以作为低成本工程估计路径。	Checked direct URL, arXiv when applicable, and OpenAlex OA metadata.
Hornik1989UAT	Article	true	Hornik, Kurt and Stinchcombe, Maxwell and White, Halbert	1989	Multilayer Feedforward Networks Are Universal Approximators	Neural Networks		2	5	359-366	10.1016/0893-6080(89)90020-8					https://doi.org/10.1016/0893-6080(89)90020-8	manual_required		No clearly legal open PDF/HTML download was found automatically; use the DOI/URL manually or through institutional access if needed.	sections_en/02_literature_review.tex:245	sections_zh/02_literature_review.tex:252	A multilayer perceptron (MLP) is adopted: it retains universal function-approximation capability \cite{Hornik1989UAT} while offering a practical compromise among training cost, implementation complexity, and engineering auditability \cite{BishopPRML2006}.	与这一工作流视角一致，本文有意保持代理模型主干的简朴：采用多层感知器（Multilayer Perceptron, MLP）作为合理的基线架构： 它既保留了通用函数逼近能力 \cite{Hornik1989UAT}，又在训练成本、实现复杂度和工程可审计性之间提供了较稳妥的折中 \cite{BishopPRML2006}。	Universal-approximation theorem justifying the MLP as an adequate function approximator for the surrogate.	通用逼近定理，支撑 MLP 作为代理模型的充分函数逼近器。	Checked direct URL, arXiv when applicable, and OpenAlex OA metadata.
Bommasani2021FoundationModels	misc	true	Bommasani, Rishi and others	2021	On the Opportunities and Risks of Foundation Models									2108.07258		https://arxiv.org/abs/2108.07258	manual_required		Open-access arXiv preprint; PDF at https://arxiv.org/pdf/2108.07258 (not auto-downloaded this session).	sections_en/01_introduction.tex:65 || sections_en/02_literature_review.tex:224	sections_zh/02_literature_review.tex:230	Large-scale data acquisition, quality-aware data curation, target and label engineering, staged training with knowledge distillation, held-out evaluation, and deployment-time adaptation are the same engineering stages now documented for large-scale machine-learning and foundation-model development \cite{Zhao2023LLMSurvey,Bommasani2021FoundationModels}; the contribution of this thesis is to carry that discipline end to end, at the scale a single optical-spray screening problem actually demands. || Surveys of that field document a recurring, stage-structured workflow rather than a single monolithic fit \cite{Zhao2023LLMSurvey,Bommasani2021FoundationModels}: reliability is engineered through data-centric curation and quality filtering \cite{Albalak2024DataSelection}, deliberate target- and distillation-label construction \cite{Xu2024LLMDistillation,Liu2024SyntheticData}, a staged pre-training--distillation--fine-tuning curriculum, held-out and calibration-aware evaluation \cite{Chang2024LLMEval}, and deployment-time adaptation through lightweight adapters \cite{Han2024PEFT}.	该领域的综述文献记录了一种反复出现的、分阶段的工作流，而非单一整体拟合 \cite{Zhao2023LLMSurvey,Bommasani2021FoundationModels}：可靠性是通过以数据为中心的整理与质量过滤 \cite{Albalak2024DataSelection}、有意设计的目标与蒸馏标签构造 \cite{Xu2024LLMDistillation,Liu2024SyntheticData}、分阶段的预训练--蒸馏--微调课程、留出集与校准感知评估 \cite{Chang2024LLMEval}，以及通过轻量适配器实现的部署期适应 \cite{Han2024PEFT} 共同工程化实现的。	Position paper that coined 'foundation models' and frames the broad-pretraining-then-adaptation paradigm cited as the methodological template.	提出“基础模型”概念的立场论文，勾勒广域预训练-再适配范式，作为方法论模板依据。	arXiv abstract page fetched and metadata cross-checked (title/authors/ID) during deep-research; adversarial re-verification did not complete (usage-limit outage) -- confirm arXiv ID before final submission. ZH thesis not yet mirrored, so Chinese columns pending.
Zhao2023LLMSurvey	misc	true	Zhao, Wayne Xin and others	2023	A Survey of Large Language Models									2303.18223		https://arxiv.org/abs/2303.18223	manual_required		Open-access arXiv preprint; PDF at https://arxiv.org/pdf/2303.18223 (not auto-downloaded this session).	sections_en/01_introduction.tex:65 || sections_en/02_literature_review.tex:224 || sections_en/02_literature_review.tex:238 || sections_en/07_conclusions.tex:58	sections_zh/02_literature_review.tex:230 || sections_zh/02_literature_review.tex:244	Large-scale data acquisition, quality-aware data curation, target and label engineering, staged training with knowledge distillation, held-out evaluation, and deployment-time adaptation are the same engineering stages now documented for large-scale machine-learning and foundation-model development \cite{Zhao2023LLMSurvey,Bommasani2021FoundationModels}; the contribution of this thesis is to carry that discipline end to end, at the scale a single optical-spray screening problem actually demands. || Surveys of that field document a recurring, stage-structured workflow rather than a single monolithic fit \cite{Zhao2023LLMSurvey,Bommasani2021FoundationModels}: reliability is engineered through data-centric curation and quality filtering \cite{Albalak2024DataSelection}, deliberate target- and distillation-label construction \cite{Xu2024LLMDistillation,Liu2024SyntheticData}, a staged pre-training--distillation--fine-tuning curriculum, held-out and calibration-aware evaluation \cite{Chang2024LLMEval}, and deployment-time adaptation through lightweight adapters \cite{Han2024PEFT}. || 42\linewidth}@{}} \toprule & \textbf{This thesis (spray surrogate)} & \textbf{Large-scale ML / foundation-model engineering} \\ \midrule 1 & Data extraction: CV\,+\,CUDA, Mie video $\to$ 1D penetration & Web-scale corpus acquisition \cite{Penedo2023RefinedWeb} \\ 2 & Censoring-aware curation; three derived data populations & Data-centric curation and quality filtering \cite{Albalak2024DataSelection} \\ 3 & $A$-scaling feature; $q_1$ penetration targets & Target and distillation-label construction \cite{Xu2024LLMDistillation} \\ 4 & Three-stage MLP with knowledge distillation & Pre-training $\to$ distillation $\to$ fine-tuning \cite{Zhao2023LLMSurvey} \\ 5 & Leave-one-nozzle-out and calibration checks & Held-out / out-of-distribution benchmarks and calibration \cite{Chang2024LLMEval} \\ 6 & Family-head / residual adapters and screening GUI & Serving with adapter (PEFT) fine-tuning \cite{Han2024PEFT} \\ \bottomrule \end{tabular} \end{table} || Data extraction from a raw archive, censoring-aware curation, physics-informed target construction, staged training with knowledge distillation, held-out evaluation, and deployment-time adaptation are the same stages now documented for large-scale machine-learning systems~\cite{Zhao2023LLMSurvey}.	该领域的综述文献记录了一种反复出现的、分阶段的工作流，而非单一整体拟合 \cite{Zhao2023LLMSurvey,Bommasani2021FoundationModels}：可靠性是通过以数据为中心的整理与质量过滤 \cite{Albalak2024DataSelection}、有意设计的目标与蒸馏标签构造 \cite{Xu2024LLMDistillation,Liu2024SyntheticData}、分阶段的预训练--蒸馏--微调课程、留出集与校准感知评估 \cite{Chang2024LLMEval}，以及通过轻量适配器实现的部署期适应 \cite{Han2024PEFT} 共同工程化实现的。 || 42\linewidth}@{}} \toprule & \textbf{本文（喷雾代理模型）} & \textbf{大规模机器学习/基础模型工程} \\ \midrule 1 & 数据提取：CV\,+\,CUDA，Mie 视频 $\to$ 一维贯穿距离 & 网络级语料获取 \cite{Penedo2023RefinedWeb} \\ 2 & 删失感知整理；三个派生数据群体 & 以数据为中心的整理与质量过滤 \cite{Albalak2024DataSelection} \\ 3 & $A$ 缩放特征；$q_1$ 贯穿距离目标 & 目标与蒸馏标签构造 \cite{Xu2024LLMDistillation} \\ 4 & 带知识蒸馏的三阶段 MLP & 预训练 $\to$ 蒸馏 $\to$ 微调 \cite{Zhao2023LLMSurvey} \\ 5 & 留一喷嘴测试与校准检查 & 留出/分布外基准与校准 \cite{Chang2024LLMEval} \\ 6 & 残差头/适配器与筛查 GUI & 带适配器（PEFT）微调的部署 \cite{Han2024PEFT} \\ \bottomrule \end{tabular} \end{table}	Umbrella survey of the large-language-model development lifecycle (pre-training, adaptation, utilization, evaluation); anchors the thesis's six-stage engineering-workflow parallel.	大语言模型开发生命周期综述（预训练、适配、使用、评估），作为本文六阶段工程工作流类比的伞式参考。	arXiv abstract page fetched and metadata cross-checked (title/authors/ID) during deep-research; adversarial re-verification did not complete (usage-limit outage) -- confirm arXiv ID before final submission. ZH thesis not yet mirrored, so Chinese columns pending.
