bib_key	entry_type	used_in_tex	authors	year	title	container	publisher_or_institution	volume	number	pages	doi	url	isbn	eprint	bib_note	source_link	download_status	downloaded_file_path	manual_reason	english_tex_locations	chinese_tex_locations	english_citation_sentences	chinese_citation_sentences	english_reference_meaning	chinese_reference_meaning	verification_notes
Taubin1991CircleFit	Article	true	Taubin, Gabriel	1991	Estimation of Planar Curves, Surfaces, and Nonplanar Space Curves Defined by Implicit Equations, with Applications to Edge and Range Image Segmentation	IEEE Transactions on Pattern Analysis and Machine Intelligence		13	11	1115-1138	10.1109/34.103273					https://doi.org/10.1109/34.103273	manual_required		No clearly legal open PDF/HTML download was found automatically; use the DOI/URL manually or through institutional access if needed.	sections_en/02_literature_review.tex:161 || sections_en/03_data_workflow.tex:149	sections_zh/02_literature_review.tex:166 || sections_zh/03_data_workflow.tex:147	This task is essentially noisy circle fitting, for which least-squares circle estimation is a standard tool \cite{Pratt1987CircleFit,Taubin1991CircleFit}. || This one-time calibration is deliberately kept as a user-visible operation rather than fully automated: operators can zoom in, select representative frames, and anchor the entire batch process with a physically meaningful nozzle center \cite{Pratt1987CircleFit,Taubin1991CircleFit}.	该任务本质上是带噪圆拟合，最小二乘圆估计是处理此类问题的标准工具 \cite{Pratt1987CircleFit,Taubin1991CircleFit}。 || 这种一次性标定刻意保留为用户可见的操作，而不是全自动：操作者可以放大、选择代表性帧，并用一个物理上有意义的喷嘴中心来锚定整个批处理 \cite{Pratt1987CircleFit,Taubin1991CircleFit}.	Supports algebraic curve and circle fitting as a standard approach for noisy image-coordinate calibration.	用于支撑在有噪声图像坐标中进行圆/曲线拟合标定的标准性。	Checked direct URL, arXiv when applicable, and OpenAlex OA metadata.
GonzalezWoodsDIP	Book	true	Gonzalez, Rafael C. and Woods, Richard E.	2018	Digital Image Processing		Pearson						9780133356724				manual_required		No DOI or URL is present in the BibTeX entry; manual lookup is required.	sections_en/02_literature_review.tex:158 || sections_en/02_literature_review.tex:169 || sections_en/02_literature_review.tex:181 || sections_en/02_literature_review.tex:208 || sections_en/03_data_workflow.tex:191 || sections_en/03_data_workflow.tex:222 || sections_en/03_data_workflow.tex:264	sections_zh/02_literature_review.tex:163 || sections_zh/02_literature_review.tex:174 || sections_zh/02_literature_review.tex:186 || sections_zh/02_literature_review.tex:214 || sections_zh/03_data_workflow.tex:190 || sections_zh/03_data_workflow.tex:221 || sections_zh/03_data_workflow.tex:263	Therefore, these operations not only have a clear image processing rationale but are also naturally suited for tensorized CUDA (Compute Unified Device Architecture) parallel implementations organized under the Single Instruction Multiple Thread (SIMT) execution model of GPU hardware \cite{NickollsBuckGarlandSkadron2008,GonzalezWoodsDIP,Szeliski2010Vision}. || Building upon this, log-domain background subtraction and foreground construction draw on the basic idea of homomorphic signal processing: when the image formation process contains multiplicative components, taking the logarithm transforms multiplicative disturbances into additive ones, thereby improving the stability of subsequent background subtraction and filtering \cite{OppenheimSchaferStockham1968,GonzalezWoodsDIP}. || Following foreground construction, Sobel-like gradient magnitude operators, percentile scaling, automated thresholding, and morphological operations are sequentially applied to enhance and extract the spray boundaries while suppressing diffuse low-frequency background structures \cite{GonzalezWoodsDIP,Szeliski2010Vision,ZackRogersLatt1977}. || GPUs are particularly suited for dense array operations, template-based neighborhood computations, and repetitive map-reduce pattern workloads, as the same arithmetic pattern can be executed in parallel over vast numbers of data elements \cite{NickollsBuckGarlandSkadron2008}; the operators used in this thesis are themselves standard image processing primitives \cite{GonzalezWoodsDIP,Szeliski2010Vision}. || This sequence is critical for Mie videos, as the raw intensity is not a direct measure of liquid volume fraction; the actual goal is to stably extract geometry under non-uniform illumination, glare, and background textures, rather than performing a rigorous optical inversion \cite{BohrenHuffman2004,Linne2013SprayImaging,GonzalezWoodsDIP}. || Quantitative computations use a robust background estimation from pre-injection statistics, and convert the representation into an edge-dominant Sobel feature space, ensuring the geometric response is dictated by fixed operators and local boundary structures rather than display brightness \cite{BohrenHuffman2004,Linne2013SprayImaging,GonzalezWoodsDIP}. || The contribution here lies not in the Sobel operator itself, but in its integration into a batch video workflow that avoids repeated host-device copies, preparing a consistent downstream geometric processing for each plume \cite{GonzalezWoodsDIP,Szeliski2010Vision}.	因此，这些操作不仅具有明确的图像处理依据，也天然适合按 GPU 硬件单指令多线程（SIMT）执行模型组织的张量化 CUDA（统一计算设备架构）并行实现 \cite{NickollsBuckGarlandSkadron2008,GonzalezWoodsDIP,Szeliski2010Vision}。 || 在此基础上，对数域背景消除与前景构建借鉴了同态信号处理的基本思想： 当图像形成过程含有乘性成分时，取对数可将乘法扰动转化为加性扰动，从而提高后续背景扣除和滤波的稳定性 \cite{OppenheimSchaferStockham1968,GonzalezWoodsDIP}。 || 前景构建之后，Sobel 类梯度幅值算子、百分位缩放、自动阈值和形态学操作被依次用于增强并提取喷雾边界，同时压低弥散的低频背景结构 \cite{GonzalezWoodsDIP,Szeliski2010Vision,ZackRogersLatt1977}。 || GPU 特别适合稠密阵列运算、模板式邻域计算和重复 map--reduce 模式为主的负载，因为同一算术模式可在大量数据元素上并行执行 \cite{NickollsBuckGarlandSkadron2008}；本文所用算子本身亦为标准图像处理基元 \cite{GonzalezWoodsDIP,Szeliski2010Vision}。 || 这一序列对 Mie 视频很重要，因为原始强度并不是液体体积分数的直接度量，而实际目标是在非均匀照明、眩光和背景纹理下稳定提取几何，而不是做精确光学反演 \cite{BohrenHuffman2004,Linne2013SprayImaging,GonzalezWoodsDIP}。 || 定量计算则使用喷射前统计得到的稳健背景估计，再把表示转换成边缘主导的 Sobel 特征，使几何响应主要由固定算子和局部边界结构决定，而不是由显示亮度决定 \cite{BohrenHuffman2004,Linne2013SprayImaging,GonzalezWoodsDIP}。 || 这里的贡献不在于 Sobel 算子本身，而在于把它集成进一条避免反复主机--设备拷贝的批量视频工作流中，为每个羽流准备一致的下游几何处理 \cite{GonzalezWoodsDIP,Szeliski2010Vision}。	Supports the image-processing choices: log-domain preprocessing, gradients, thresholding, morphology, and boundary extraction.	用于支撑对数预处理、梯度算子、阈值、形态学和边界提取等图像处理步骤。	No machine-resolvable link in BibTeX.
Cromey2010TwistedPixels	Article	true	Cromey, Douglas W.	2010	Avoiding Twisted Pixels: Ethical Guidelines for the Appropriate Use and Manipulation of Scientific Digital Images	Science and Engineering Ethics		16	4	639-667	10.1007/s11948-010-9201-y					https://doi.org/10.1007/s11948-010-9201-y	manual_required		No clearly legal open PDF/HTML download was found automatically; use the DOI/URL manually or through institutional access if needed.	sections_en/02_literature_review.tex:56 || sections_en/03_data_workflow.tex:220	sections_zh/02_literature_review.tex:59 || sections_zh/03_data_workflow.tex:219	Equally important is that quantitative processing should strive to preserve the linear response of the camera's raw gray values, and should not use display-oriented gamma correction, frame-by-frame display gain, or local contrast enhancement as measurement inputs \cite{Cromey2010TwistedPixels}. || This example does not dictate which display gain is physically more truthful, but illustrates that if gamma-corrected, display-gain-adjusted, or locally contrast-enhanced frames were used for boundary extraction, the boundaries would shift with the display mapping \cite{Cromey2010TwistedPixels}.	同样重要的是，定量处理应尽量保留相机原始灰度的线性响应，而不应将面向显示的 gamma 校正、逐帧显示增益或局部对比度增强作为测量输入 \cite{Cromey2010TwistedPixels}。 || 这个例子并不是在说明哪种显示增益更接近物理真实，而是在说明如果把 gamma 校正、显示增益调整或局部对比度增强后的帧用于边界提取，边界会随着显示映射而变化 \cite{Cromey2010TwistedPixels}。	Scientific-image-processing ethics: nonlinear display adjustments (gamma, display gain, local contrast) must not be treated as quantitative measurement inputs.	科学图像处理伦理：gamma、显示增益、局部对比度等非线性显示调整不得作为定量测量输入。	Checked DOI and accessible metadata. The paper classifies scientific digital images as data, identifies gamma and histogram-based adjustments as operations that can alter intensity relationships, and states that intensity measurements should use uniformly processed data calibrated to a known standard.
Szeliski2010Vision	Book	true	Szeliski, Richard	2011	Computer Vision: Algorithms and Applications		Springer				10.1007/978-1-84882-935-0					https://doi.org/10.1007/978-1-84882-935-0	downloaded	reference_sources/Szeliski2010Vision.pdf		sections_en/02_literature_review.tex:158 || sections_en/02_literature_review.tex:181 || sections_en/02_literature_review.tex:200 || sections_en/02_literature_review.tex:208 || sections_en/03_data_workflow.tex:264 || sections_en/03_data_workflow.tex:288 || sections_en/03_data_workflow.tex:313 || sections_en/03_data_workflow.tex:365	sections_zh/02_literature_review.tex:163 || sections_zh/02_literature_review.tex:186 || sections_zh/02_literature_review.tex:206 || sections_zh/02_literature_review.tex:214 || sections_zh/03_data_workflow.tex:263 || sections_zh/03_data_workflow.tex:287 || sections_zh/03_data_workflow.tex:309 || sections_zh/03_data_workflow.tex:361	Therefore, these operations not only have a clear image processing rationale but are also naturally suited for tensorized CUDA (Compute Unified Device Architecture) parallel implementations organized under the Single Instruction Multiple Thread (SIMT) execution model of GPU hardware \cite{NickollsBuckGarlandSkadron2008,GonzalezWoodsDIP,Szeliski2010Vision}. || Following foreground construction, Sobel-like gradient magnitude operators, percentile scaling, automated thresholding, and morphological operations are sequentially applied to enhance and extract the spray boundaries while suppressing diffuse low-frequency background structures \cite{GonzalezWoodsDIP,Szeliski2010Vision,ZackRogersLatt1977}. || To this end, the workflow transitions from Cartesian image coordinates to nozzle-centered polar coordinates, folding the 2D repeating structure into a 1D occupancy signal along the angular axis \cite{Szeliski2010Vision}. || GPUs are particularly suited for dense array operations, template-based neighborhood computations, and repetitive map-reduce pattern workloads, as the same arithmetic pattern can be executed in parallel over vast numbers of data elements \cite{NickollsBuckGarlandSkadron2008}; the operators used in this thesis are themselves standard image processing primitives \cite{GonzalezWoodsDIP,Szeliski2010Vision}. || The contribution here lies not in the Sobel operator itself, but in its integration into a batch video workflow that avoids repeated host-device copies, preparing a consistent downstream geometric processing for each plume \cite{GonzalezWoodsDIP,Szeliski2010Vision}. || Conceptually, this radially compresses the 2D image into a 1D angular occupancy signal; for multi-hole alignment, it is significantly more stable than edge fragments in the raw frames \cite{Szeliski2010Vision}. || While FFT itself is standard, the contribution here is transforming the angular density signal into an automatic plume registration rule using the known multi-hole count of the injector while preserving plume-to-plume asymmetry in the downstream observables \cite{CooleyTukey1965FFT,Szeliski2010Vision}. || Because the inverse map is precomputed once per plume angle, the per-frame overhead is rotation-agnostic; all subsequent metrics are measured in this shared local strip coordinate system \cite{Szeliski2010Vision}.	因此，这些操作不仅具有明确的图像处理依据，也天然适合按 GPU 硬件单指令多线程（SIMT）执行模型组织的张量化 CUDA（统一计算设备架构）并行实现 \cite{NickollsBuckGarlandSkadron2008,GonzalezWoodsDIP,Szeliski2010Vision}。 || 前景构建之后，Sobel 类梯度幅值算子、百分位缩放、自动阈值和形态学操作被依次用于增强并提取喷雾边界，同时压低弥散的低频背景结构 \cite{GonzalezWoodsDIP,Szeliski2010Vision,ZackRogersLatt1977}。 || 为此，工作流从笛卡尔图像坐标转向喷嘴中心极坐标，将二维重复结构折叠为角度轴上的一维占据信号 \cite{Szeliski2010Vision}。 || GPU 特别适合稠密阵列运算、模板式邻域计算和重复 map--reduce 模式为主的负载，因为同一算术模式可在大量数据元素上并行执行 \cite{NickollsBuckGarlandSkadron2008}；本文所用算子本身亦为标准图像处理基元 \cite{GonzalezWoodsDIP,Szeliski2010Vision}。 || 这里的贡献不在于 Sobel 算子本身，而在于把它集成进一条避免反复主机--设备拷贝的批量视频工作流中，为每个羽流准备一致的下游几何处理 \cite{GonzalezWoodsDIP,Szeliski2010Vision}。 || 概念上，这是把 2D 图像径向压缩成一个 1D 角度占用信号；对多孔对齐而言，它比原始帧中的边缘碎片稳定得多 \cite{Szeliski2010Vision}。 || FFT 本身是标准方法；这里的贡献在于利用已知喷油器多孔数，把角度密度信号转成一条自动羽流配准规则 \cite{CooleyTukey1965FFT,Szeliski2010Vision}。 || 每个羽流角只需预计算一次逆映射，因此逐帧开销与旋转无关；后续所有度量都在同一个局部条带坐标系里测量 \cite{Szeliski2010Vision}。	Supports computer-vision operations such as polar resampling, inverse warping, image primitives, and geometric remapping.	用于支撑极坐标重采样、逆映射、图像处理原语和几何重映射等计算机视觉操作。	Downloaded legal open PDF from https://szeliski.org/Book/drafts/SzeliskiBook_20100903_draft.pdf
CooleyTukey1965FFT	Article	true	Cooley, James W. and Tukey, John W.	1965	An Algorithm for the Machine Calculation of Complex Fourier Series	Mathematics of Computation		19	90	297-301	10.1090/S0025-5718-1965-0178586-1					https://doi.org/10.1090/S0025-5718-1965-0178586-1	manual_required		No clearly legal open PDF/HTML download was found automatically; use the DOI/URL manually or through institutional access if needed.	sections_en/03_data_workflow.tex:313	sections_zh/03_data_workflow.tex:309	While FFT itself is standard, the contribution here is transforming the angular density signal into an automatic plume registration rule using the known multi-hole count of the injector while preserving plume-to-plume asymmetry in the downstream observables \cite{CooleyTukey1965FFT,Szeliski2010Vision}.	FFT 本身是标准方法；这里的贡献在于利用已知喷油器多孔数，把角度密度信号转成一条自动羽流配准规则 \cite{CooleyTukey1965FFT,Szeliski2010Vision}。	Supports using Fourier harmonic phase to estimate the rotational offset of repeated multi-hole plume patterns.	用于支撑通过傅里叶谐波相位估计多孔喷雾重复结构的旋转偏移。	Checked direct URL, arXiv when applicable, and OpenAlex OA metadata.
KuglinHines1975PhaseCorrelation	InProceedings	true	Kuglin, Charles D. and Hines, Donald C.	1975	The Phase Correlation Image Alignment Method	Proceedings of the 1975 International Conference on Cybernetics and Society				163-165							manual_required		No DOI is present; use the bibliographic database record or proceedings manually if needed.	sections_en/02_literature_review.tex:201	sections_zh/02_literature_review.tex:207	Under this representation, the number of holes defines the natural angular frequency, and the phase of the corresponding primary harmonic provides an estimate of the rotational offset (modulo the inter-plume angular spacing); this polar--Fourier phase-correlation approach follows established image registration principles \cite{KuglinHines1975PhaseCorrelation,DeCastroMorandi1987RotationFFT}.	在该表示下，孔数定义了自然角频率，对应主谐波的相位给出旋转偏移量的估计（模孔间角距）；这一极坐标-傅里叶相位相关方法遵循已有图像配准原理 \cite{KuglinHines1975PhaseCorrelation,DeCastroMorandi1987RotationFFT}。	Foundational reference for phase-correlation image alignment.	相位相关图像配准方法的基础文献。	Verified via J-GLOBAL/CiNii bibliographic records: Proc. Int. Conf. Cybernetics and Society, 1975, pages 163-165, authors Kuglin and Hines.
DeCastroMorandi1987RotationFFT	Article	true	De Castro, E. and Morandi, C.	1987	Registration of Translated and Rotated Images Using Finite Fourier Transforms	IEEE Transactions on Pattern Analysis and Machine Intelligence		PAMI-9	5	700-703	10.1109/TPAMI.1987.4767966					https://doi.org/10.1109/TPAMI.1987.4767966	manual_required		No clearly legal open PDF/HTML download was found automatically; use the DOI/URL manually or through institutional access if needed.	sections_en/02_literature_review.tex:201	sections_zh/02_literature_review.tex:207	Under this representation, the number of holes defines the natural angular frequency, and the phase of the corresponding primary harmonic provides an estimate of the rotational offset (modulo the inter-plume angular spacing); this polar--Fourier phase-correlation approach follows established image registration principles \cite{KuglinHines1975PhaseCorrelation,DeCastroMorandi1987RotationFFT}.	在该表示下，孔数定义了自然角频率，对应主谐波的相位给出旋转偏移量的估计（模孔间角距）；这一极坐标-傅里叶相位相关方法遵循已有图像配准原理 \cite{KuglinHines1975PhaseCorrelation,DeCastroMorandi1987RotationFFT}。	Supports Fourier-domain image registration extended to translated and rotated images.	用于支撑傅里叶域图像配准可扩展到平移与旋转图像。	Verified via PubMed and DOI metadata: IEEE TPAMI, 1987, volume PAMI-9/9, issue 5, pages 700-703, DOI confirmed.
Huber1964	Article	true	Huber, Peter J.	1964	Robust Estimation of a Location Parameter	The Annals of Mathematical Statistics		35	1	73-101	10.1214/aoms/1177703732					https://doi.org/10.1214/aoms/1177703732	manual_required		No clearly legal open PDF/HTML download was found automatically; use the DOI/URL manually or through institutional access if needed.	sections_en/04_trajectory_surrogate_screening.tex:167 || sections_en/appendix_implementation_mapping.tex:138	sections_zh/04_trajectory_surrogate_screening.tex:169 || sections_zh/appendix_implementation_mapping.tex:138	This objective is solved via trust-region nonlinear least squares with \(\delta=1\), while the logarithmic parameterization preserves the positivity of the fit gains and transition scale\cite{Huber1964,NocedalWright2006}. || The Huber loss retains the squared penalty when the residual is small, and transitions to an approximate absolute value penalty once the residual exceeds a threshold, thereby reducing the leverage effect of outliers \cite{Huber1964,NocedalWright2006}.	该目标通过信赖域非线性最小二乘法求解，\(\delta=1\)，而对数参数化保持了拟合增益和过渡尺度的正性\cite{Huber1964,NocedalWright2006}。 || Huber 损失在残差较小时保留平方惩罚，在残差超过阈值后切换为近似绝对值惩罚，从而降低离群点的杠杆效应 \cite{Huber1964,NocedalWright2006}。	Supports robust fitting with Huber loss for noisy or partially contaminated penetration traces.	用于支撑在噪声或局部污染的穿深轨迹上使用 Huber 损失进行稳健拟合。	Checked direct URL, arXiv when applicable, and OpenAlex OA metadata.
OppenheimSchaferStockham1968	Article	true	Oppenheim, Alan V. and Schafer, Ronald W. and Stockham, Thomas G., Jr.	1968	Nonlinear Filtering of Multiplied and Convolved Signals	IEEE Transactions on Audio and Electroacoustics		16	3	437-466	10.1109/TAU.1968.1161990					https://doi.org/10.1109/TAU.1968.1161990	manual_required		No clearly legal open PDF/HTML download was found automatically; use the DOI/URL manually or through institutional access if needed.	sections_en/02_literature_review.tex:169	sections_zh/02_literature_review.tex:174	Building upon this, log-domain background subtraction and foreground construction draw on the basic idea of homomorphic signal processing: when the image formation process contains multiplicative components, taking the logarithm transforms multiplicative disturbances into additive ones, thereby improving the stability of subsequent background subtraction and filtering \cite{OppenheimSchaferStockham1968,GonzalezWoodsDIP}.	在此基础上，对数域背景消除与前景构建借鉴了同态信号处理的基本思想： 当图像形成过程含有乘性成分时，取对数可将乘法扰动转化为加性扰动，从而提高后续背景扣除和滤波的稳定性 \cite{OppenheimSchaferStockham1968,GonzalezWoodsDIP}。	Supports the homomorphic-filtering motivation behind log-ratio preprocessing for multiplicative illumination variation.	用于支撑对数比预处理的同态滤波动机，即将乘性照明变化转为更易处理的加性成分。	Checked direct URL, arXiv when applicable, and OpenAlex OA metadata.
ZackRogersLatt1977	Article	true	Zack, G. W. and Rogers, W. E. and Latt, S. A.	1977	Automatic Measurement of Sister Chromatid Exchange Frequency	Journal of Histochemistry and Cytochemistry		25	7	741-753	10.1177/25.7.70454					https://doi.org/10.1177/25.7.70454	manual_required		No clearly legal open PDF/HTML download was found automatically; use the DOI/URL manually or through institutional access if needed.	sections_en/02_literature_review.tex:181	sections_zh/02_literature_review.tex:186	Following foreground construction, Sobel-like gradient magnitude operators, percentile scaling, automated thresholding, and morphological operations are sequentially applied to enhance and extract the spray boundaries while suppressing diffuse low-frequency background structures \cite{GonzalezWoodsDIP,Szeliski2010Vision,ZackRogersLatt1977}.	前景构建之后，Sobel 类梯度幅值算子、百分位缩放、自动阈值和形态学操作被依次用于增强并提取喷雾边界，同时压低弥散的低频背景结构 \cite{GonzalezWoodsDIP,Szeliski2010Vision,ZackRogersLatt1977}。	Supports automatic triangle thresholding as part of the segmentation and occupancy pipeline.	用于支撑分割和占用分析流程中的自动三角阈值方法。	Checked direct URL, arXiv when applicable, and OpenAlex OA metadata.
MuenchLeipertz1992	Article	true	Munch, K. and Leipertz, A.	1992	Investigation of Spray Penetration and Fuel Distribution Inside the Piston Bowl of a 1.9 l DI Diesel Engine Using Two-Dimensional Mie Scattering	SAE Technical Paper			922204		10.4271/922204					https://doi.org/10.4271/922204	manual_required		No clearly legal open PDF/HTML download was found automatically; use the DOI/URL manually or through institutional access if needed.	sections_en/02_literature_review.tex:39	sections_zh/02_literature_review.tex:42	Early two-dimensional Mie scattering work conducted inside optical diesel engines treated the jet tip penetration and cone angle as practical outputs for image analysis, rather than pursuing complete liquid-phase state reconstruction \cite{MuenchLeipertz1992}; Even in recent imaging studies with higher instrument levels and synchronization precision, liquid-phase spray comparisons still revolve around penetration and expansion angle metrics \cite{JungManinSkeenPickett2015}.	早期在光学柴油机内部进行的二维 Mie 散射工作即将射流尖端贯穿距离与锥角作为图像分析的实用输出， 而非追求完整液相状态重建 \cite{MuenchLeipertz1992}； 即便在仪器水平和同步精度更高的近期成像研究中，液相喷雾比较仍围绕贯穿距离和扩展角度量展开 \cite{JungManinSkeenPickett2015}。	Supports using two-dimensional Mie-scattering images to report practical jet-tip penetration and cone-angle quantities.	用于支撑二维 Mie 散射图像可用于报告射流尖端穿深和锥角等实用量。	Checked direct URL, arXiv when applicable, and OpenAlex OA metadata.
